{
  "schemaVersion": 1,
  "library": "@gitcade/library",
  "version": "0.12.0",
  "generatedFrom": "parts/",
  "parts": [
    {
      "id": "ai-aim-and-fire",
      "kind": "behavior",
      "version": "1.1.0",
      "category": "ai",
      "tags": [
        "ai",
        "enemy",
        "turret",
        "shooter",
        "projectile",
        "targeting"
      ],
      "description": "Turret AI: when a target tag is within range, fire a projectile at it on a cooldown. The aiming counterpart to the player-driven shoot. 1.1.0 adds optional priorityKey/priorityOrder targeting — prefer the most-advanced creep (follow-path __pathProgress) or the strongest/weakest by an entity-state key — defaulting to nearest.",
      "license": "MIT",
      "dependencies": [
        "velocity",
        "contact-damage",
        "health-and-death"
      ],
      "params": {
        "targetTag": {
          "type": "string",
          "balance": false,
          "description": "Tag of entities to fire at."
        },
        "range": {
          "type": "number",
          "balance": true,
          "description": "Max engagement distance in px."
        },
        "cooldown": {
          "type": "number",
          "balance": true,
          "description": "Seconds between shots."
        },
        "projectile": {
          "type": "object",
          "balance": false,
          "description": "Entity-definition to spawn."
        },
        "projectileSpeed": {
          "type": "number",
          "balance": true,
          "description": "Launch speed in px/sec."
        },
        "spawnOffset": {
          "type": "object",
          "balance": false,
          "description": "{ x, y } muzzle offset (structural)."
        },
        "priorityKey": {
          "type": "string",
          "balance": false,
          "description": "Entity-state key to rank in-range targets by (e.g. '__pathProgress' for first/most-advanced, 'hp' for strongest); unset = nearest."
        },
        "priorityOrder": {
          "type": "string",
          "balance": false,
          "description": "'high' (default, largest value wins) | 'low'."
        }
      },
      "definition": {
        "type": "ai-aim-and-fire",
        "params": {
          "targetTag": "player",
          "range": "$cfg.turretRange",
          "cooldown": "$cfg.turretCooldown",
          "projectileSpeed": "$cfg.turretBulletSpeed",
          "projectile": {
            "id": "enemy-bullet",
            "sprite": {
              "kind": "shape",
              "shape": "circle",
              "color": "#ff6b6b"
            },
            "size": {
              "w": 8,
              "h": 8
            },
            "tags": [
              "enemy-bullet"
            ],
            "layer": 3,
            "behaviors": [
              {
                "type": "velocity",
                "params": {}
              },
              {
                "type": "contact-damage",
                "params": {
                  "targetTag": "player",
                  "damage": "$cfg.turretBulletDamage",
                  "selfDestruct": true
                }
              },
              {
                "type": "health-and-death",
                "params": {
                  "hp": "$cfg.bulletHp",
                  "lifespan": "$cfg.bulletLifespan"
                }
              }
            ]
          }
        }
      }
    },
    {
      "id": "ai-chase",
      "kind": "behavior",
      "version": "1.0.0",
      "category": "ai",
      "tags": [
        "ai",
        "enemy",
        "pursuit",
        "movement",
        "reuse-proof"
      ],
      "description": "Pursue the nearest entity of a target tag in full 2D, with optional axis lock and acceleration. Generalizes the SDK follow-entity-axis primitive. One of the four reuse-proof parts.",
      "license": "MIT",
      "dependencies": [
        "velocity"
      ],
      "params": {
        "targetTag": {
          "type": "string",
          "balance": false,
          "description": "Tag of the entity to pursue."
        },
        "speed": {
          "type": "number",
          "balance": true,
          "description": "Pursuit speed in px/sec."
        },
        "stopDistance": {
          "type": "number",
          "balance": true,
          "description": "Center distance within which it holds still."
        },
        "accel": {
          "type": "number",
          "balance": true,
          "description": "Optional approach acceleration in px/sec² (0 = snap)."
        },
        "lockAxis": {
          "type": "string",
          "balance": false,
          "description": "'x' | 'y' | 'none' — constrain pursuit to one axis."
        }
      },
      "definition": {
        "type": "ai-chase",
        "params": {
          "targetTag": "player",
          "speed": "$cfg.enemySpeed",
          "stopDistance": "$cfg.enemyStopDistance",
          "lockAxis": "none"
        }
      }
    },
    {
      "id": "ai-flee",
      "kind": "behavior",
      "version": "1.0.0",
      "category": "ai",
      "tags": [
        "ai",
        "enemy",
        "flee",
        "movement"
      ],
      "description": "Flee from the nearest entity of a threat tag — the mirror of ai-chase — panicking only within an optional radius. Sets velocity for a following velocity integrator.",
      "license": "MIT",
      "dependencies": [
        "velocity"
      ],
      "params": {
        "threatTag": {
          "type": "string",
          "balance": false,
          "description": "Tag of the entity to flee from."
        },
        "speed": {
          "type": "number",
          "balance": true,
          "description": "Flee speed in px/sec."
        },
        "panicDistance": {
          "type": "number",
          "balance": true,
          "description": "Only flee when the threat is within this distance (0 = always)."
        },
        "accel": {
          "type": "number",
          "balance": true,
          "description": "Optional acceleration in px/sec² (0 = snap)."
        },
        "lockAxis": {
          "type": "string",
          "balance": false,
          "description": "'x' | 'y' | 'none' — constrain fleeing to one axis."
        }
      },
      "definition": {
        "type": "ai-flee",
        "params": {
          "threatTag": "player",
          "speed": "$cfg.preySpeed",
          "panicDistance": "$cfg.preyPanicDistance"
        }
      }
    },
    {
      "id": "ai-patrol",
      "kind": "behavior",
      "version": "1.0.0",
      "category": "ai",
      "tags": [
        "ai",
        "enemy",
        "patrol",
        "guard",
        "movement"
      ],
      "description": "Patrol between waypoints with dwell time at each, ping-pong or loop — the guard/sentry pattern. Sets velocity for a following velocity integrator.",
      "license": "MIT",
      "dependencies": [
        "velocity"
      ],
      "params": {
        "points": {
          "type": "array",
          "balance": false,
          "description": "Array of { x, y } patrol waypoints (structural)."
        },
        "speed": {
          "type": "number",
          "balance": true,
          "description": "Patrol speed in px/sec."
        },
        "waitTime": {
          "type": "number",
          "balance": true,
          "description": "Dwell time at each waypoint in seconds."
        },
        "pingPong": {
          "type": "boolean",
          "balance": false,
          "description": "Reverse at the ends instead of looping."
        },
        "arriveRadius": {
          "type": "number",
          "balance": false,
          "description": "Distance at which a waypoint is reached (structural)."
        }
      },
      "definition": {
        "type": "ai-patrol",
        "params": {
          "points": [
            {
              "x": 100,
              "y": 200
            },
            {
              "x": 400,
              "y": 200
            }
          ],
          "speed": "$cfg.guardSpeed",
          "waitTime": "$cfg.guardWaitTime",
          "arriveRadius": 6
        }
      }
    },
    {
      "id": "ai-wander",
      "kind": "behavior",
      "version": "1.0.0",
      "category": "ai",
      "tags": [
        "ai",
        "enemy",
        "wander",
        "ambient",
        "movement"
      ],
      "description": "Drift in a heading that re-randomizes periodically, turning away from world edges; deterministic via world.rng. Sets velocity for a following velocity integrator.",
      "license": "MIT",
      "dependencies": [
        "velocity"
      ],
      "params": {
        "speed": {
          "type": "number",
          "balance": true,
          "description": "Wander speed in px/sec."
        },
        "changeInterval": {
          "type": "number",
          "balance": true,
          "description": "Seconds between heading changes."
        },
        "edgePadding": {
          "type": "number",
          "balance": false,
          "description": "Distance from a wall at which it turns inward (structural)."
        }
      },
      "definition": {
        "type": "ai-wander",
        "params": {
          "speed": "$cfg.critterSpeed",
          "changeInterval": "$cfg.wanderInterval",
          "edgePadding": 16
        }
      }
    },
    {
      "id": "auto-scroll",
      "kind": "behavior",
      "version": "1.0.0",
      "category": "movement",
      "tags": [
        "movement",
        "scroller",
        "parallax",
        "auto"
      ],
      "description": "Force a constant velocity each tick, optionally wrapping back to the opposite edge — scrolling worlds/tiles or auto-advancing scroller obstacles. Sets velocity for a following velocity integrator.",
      "license": "MIT",
      "dependencies": [
        "velocity"
      ],
      "params": {
        "vx": {
          "type": "number",
          "balance": true,